<?xml version="1.0" encoding="UTF-8"?>
<!--
/**
 * {license_notice}
 *
 * @copyright   {copyright}
 * @license     {license_link}
 */
-->
<xs:schema xmlns:xs="http://www.w3.org/2001/XMLSchema">
    <xs:element name="config">
        <xs:complexType>
            <xs:sequence>
                <xs:element name="module" type="moduleDeclaration" minOccurs="1" maxOccurs="unbounded" />
            </xs:sequence>
        </xs:complexType>
        <xs:unique name="uniqueModuleName">
            <xs:annotation>
                <xs:documentation>
                    Module name must be unique.
                </xs:documentation>
            </xs:annotation>
            <xs:selector xpath="module"/>
            <xs:field xpath="@name"/>
        </xs:unique>
    </xs:element>

    <xs:complexType name="moduleDeclaration">
        <xs:annotation>
            <xs:documentation>
                Module declaration.
            </xs:documentation>
        </xs:annotation>
        <xs:all>
            <xs:element minOccurs="0" maxOccurs="1" name="depends" type="moduleDependency">
                <xs:unique name="uniqueDependencyName">
                    <xs:annotation>
                        <xs:documentation>
                            Dependency name must be unique.
                        </xs:documentation>
                    </xs:annotation>
                    <xs:selector xpath=".//*" />
                    <xs:field xpath="@name" />
                </xs:unique>
            </xs:element>
            <xs:element minOccurs="0" maxOccurs="1" name="sequence" type="moduleSequence">
                <xs:unique name="uniqueSequenceName">
                    <xs:annotation>
                        <xs:documentation>
                            Dependency name must be unique.
                        </xs:documentation>
                    </xs:annotation>
                    <xs:selector xpath=".//*" />
                    <xs:field xpath="@name" />
                </xs:unique>
            </xs:element>
        </xs:all>
        <xs:attribute name="name" type="moduleName" use="required" />
        <xs:attribute name="version" type="moduleVersion" use="optional" />
        <xs:attribute name="active" type="xs:boolean" use="optional" />
    </xs:complexType>

    <xs:complexType name="moduleDependency">
        <xs:annotation>
            <xs:documentation>
                Module dependency root element.
            </xs:documentation>
        </xs:annotation>
        <xs:choice maxOccurs="unbounded">
            <xs:element minOccurs="0" maxOccurs="unbounded" name="module">
                <xs:complexType>
                    <xs:annotation>
                        <xs:documentation>
                            Module dependency that represents another module.
                        </xs:documentation>
                    </xs:annotation>
                    <xs:attribute name="name" type="moduleName" use="required" />
                    <xs:attribute name="type" type="moduleDependencyType" use="optional" />
                </xs:complexType>
            </xs:element>
            <xs:element minOccurs="0" maxOccurs="unbounded" name="extension" type="extensionElement" />
            <xs:element minOccurs="0" maxOccurs="unbounded" name="choice">
                <xs:complexType>
                    <xs:annotation>
                        <xs:documentation>
                            Element that holds alternative extension dependencies.
                        </xs:documentation>
                    </xs:annotation>
                    <xs:sequence>
                        <xs:element minOccurs="2" maxOccurs="unbounded" name="extension" type="extensionElement" />
                    </xs:sequence>
                </xs:complexType>
            </xs:element>
        </xs:choice>
    </xs:complexType>

    <xs:complexType name="moduleSequence">
        <xs:annotation>
            <xs:documentation>
                Module dependency root element.
            </xs:documentation>
        </xs:annotation>
        <xs:sequence maxOccurs="unbounded">
            <xs:element minOccurs="0" maxOccurs="unbounded" name="module">
                <xs:complexType>
                    <xs:annotation>
                        <xs:documentation>
                            Module dependency that represents another module.
                        </xs:documentation>
                    </xs:annotation>
                    <xs:attribute name="name" type="moduleName" use="required" />
                </xs:complexType>
            </xs:element>
        </xs:sequence>
    </xs:complexType>

    <xs:simpleType name="moduleDependencyType">
        <xs:annotation>
            <xs:documentation>
                Module dependency type can only be hard or soft.
            </xs:documentation>
        </xs:annotation>
        <xs:restriction base="xs:string">
            <xs:pattern value="(hard|soft)?" />
        </xs:restriction>
    </xs:simpleType>

    <xs:complexType name="extensionElement">
        <xs:annotation>
            <xs:documentation>
                Module dependency that represents PHP extension.
            </xs:documentation>
        </xs:annotation>
        <xs:attribute name="name" type="xs:string" use="required" />
        <xs:attribute name="minVersion" type="xs:string" use="optional" />
    </xs:complexType>

    <xs:simpleType name="moduleName">
        <xs:annotation>
            <xs:documentation>
                Module name attribute can contain only [A-Za-z0-9_].
            </xs:documentation>
        </xs:annotation>
        <xs:restriction base="xs:string">
            <xs:pattern value="[A-Z]+[a-z0-9]{1,}_[A-Z]+[A-Z0-9a-z]{1,}" />
        </xs:restriction>
    </xs:simpleType>

    <xs:simpleType name="moduleVersion">
        <xs:annotation>
            <xs:documentation>
                Module version attribute can contain only [0-9.].
            </xs:documentation>
        </xs:annotation>
        <xs:restriction base="xs:string">
            <xs:pattern value="[0-9.]+" />
        </xs:restriction>
    </xs:simpleType>
</xs:schema>
