<?xml version="1.0"?>
<!--
/**
 * {license_notice}
 *
 * @copyright   {copyright}
 * @license     {license_link}
 */
-->
<config xmlns:xsi="http://www.w3.org/2001/XMLSchema-instance" xsi:noNamespaceSchemaLocation="../../../../../lib/internal/Magento/Framework/Module/etc/module.xsd">
    <module name="Magento_ScheduledImportExport" version="1.11.0.3" active="true">
        <sequence>
            <module name="Magento_ImportExport"/>
        </sequence>
        <depends>
            <module name="Magento_Store"/>
            <module name="Magento_ImportExport"/>
            <module name="Magento_Backend"/>
            <module name="Magento_Cron"/>
        </depends>
    </module>
</config>
